{"authority_effect":"NONE","decision_pack_manifest":null,"details":{"accountable_roles":{"business_owner":"Customer Operations","legal_reviewer":"Legal Review","privacy_reviewer":"Privacy Review","residual_risk_acceptance_authority":"Risk Committee","security_reviewer":"Security Review","technical_owner":"Platform Engineering"},"current_decision":"conditionally_authorized","dependency_state":[{"id":"agentic-stateful-revocation","state":"NOT_YET_ESTABLISHED"}],"evidence_state":"PRESENT","governed_system_reference":"SYSTEM-SYNTH-CS-001","review_expiration":"2027-01-31T00:00:00Z","stop_condition":"Stop use if monitoring fails or an action bypasses human review.","top_condition":"Keep human review on every proposed customer action."},"evaluation_time":"2026-08-29T12:00:00Z","evidence_references":[{"reference":"SYNTH-CISO-EVIDENCE-001","type":"ARTIFACT_ID"}],"findings":[],"profile_id":"ciso-ai-risk-v0.1","profile_version":"0.1.0","schema_version":"1.0.0","source_artifact_sha256":"sha256:672f9bcc18799b2b0cfc89dd864d574ce245d652680b522791289acacd4611a4","status":"PASS","summary":"Submitted profile passed its bounded structural and integrity checks."}
